{
  "schemaVersion": "1.0",
  "packageId": "classic",
  "name": "Classic DesignIT",
  "tokens": {
    "color": {
      "brandPrimary": {
        "value": "#04073f",
        "role": "top navigation and primary brand areas"
      },
      "brandAccent": {
        "value": "#007acc",
        "role": "interactive accents and focus states"
      },
      "surface": {
        "value": "#ffffff",
        "role": "main canvas background"
      },
      "surfaceMuted": {
        "value": "#f9f9f9",
        "role": "panel background"
      },
      "text": {
        "value": "#333333",
        "role": "body text"
      }
    },
    "font": {
      "heading": {
        "value": "Verdana, Geneva, sans-serif"
      },
      "body": {
        "value": "Verdana, Geneva, sans-serif"
      },
      "mono": {
        "value": "Consolas, Monaco, monospace"
      }
    },
    "space": {
      "2": "0.5rem",
      "3": "0.75rem",
      "4": "1rem",
      "6": "1.5rem",
      "8": "2rem"
    },
    "radius": {
      "sm": "0.25rem",
      "md": "0.375rem"
    },
    "shadow": {
      "sm": "0 1px 3px rgba(0, 0, 0, 0.1)",
      "md": "0 4px 12px rgba(0, 0, 0, 0.18)"
    }
  }
}
